{
  "schema_version": "1.0",
  "interface_id": "web-item-availability",
  "revision": 1,
  "input_sha256": "392bc1d2d64eb396766339b5a06ad0aab2c33ba9b8f647276809d6964df8bbf5",
  "generated_at": "2026-09-29T05:51:25.397442+00:00",
  "summary": "All seven source fields have been assessed. No end-to-end mapping is confirmed yet. Start with intended Shopify behavior, quantity meaning and location scope.",
  "target_candidates": [
    {
      "name": "Inventory synchronization",
      "operation": "inventorySetQuantities",
      "state": "candidate",
      "when": "If the feed owns absolute stock totals and is intended to update inventory.",
      "evidence_ids": [
        "set-quantities",
        "set-input",
        "quantity-input"
      ]
    },
    {
      "name": "Availability display",
      "operation": "Storefront ProductVariant / optional metafieldsSet",
      "state": "alternative",
      "when": "If this interface supplies customer-facing availability. Storefront fields can be read; custom date/message storage needs a separate design.",
      "evidence_ids": [
        "storefront-variant",
        "metafields"
      ]
    }
  ],
  "observations": [
    {
      "kind": "observed",
      "text": "The embedded WSDL schema defines seven optional fields. Dates are dateTime, quantity is int, InStock is boolean, and the remaining fields are strings.",
      "evidence_ids": [
        "source-contract"
      ]
    },
    {
      "kind": "observed",
      "text": "Nine records: eight in stock and one out of stock. The zero-stock record has 2049-12-31 and Not Available. This co-occurrence does not establish a business rule.",
      "evidence_ids": [
        "source-sample"
      ]
    },
    {
      "kind": "data_issue",
      "text": "The pasted excerpt is incomplete XML. A separate normalized copy adds only the two missing closing tags.",
      "evidence_ids": [
        "source-sample"
      ]
    },
    {
      "kind": "data_issue",
      "text": "The sample repeats WebAvailabilityData directly. The WSDL uses GetWebItemAvailabilityResponse → GetWebItemAvailabilityResult → WebAvailabilityData → WebAvailabilityItem. Origin or transformation is unknown.",
      "evidence_ids": [
        "source-contract",
        "source-sample"
      ]
    },
    {
      "kind": "research_note",
      "text": "Shopify mutation examples/prose include legacy compareQuantity wording. The 2026-07 input reference specifies changeFromQuantity. This POC follows that input reference; no live schema validation has run.",
      "evidence_ids": [
        "set-quantities",
        "quantity-input"
      ]
    }
  ],
  "mappings": [
    {
      "source_field": "AvailableDate",
      "source_type": "xs:dateTime",
      "status": "needs_input",
      "target": "No direct field in inventorySetQuantities",
      "reason": "Meaning, timezone and customer display requirements are unknown.",
      "proposed_rule": "Preserve raw value. Consider a custom field only after agreeing its meaning; do not treat 2049-12-31 as a confirmed delivery date.",
      "question_ids": [
        "Q01",
        "Q06"
      ],
      "evidence_ids": [
        "source-contract",
        "source-sample",
        "quantity-input",
        "metafields"
      ],
      "decision_basis": "proposal",
      "confirmed_by": null
    },
    {
      "source_field": "AvailableDateRange",
      "source_type": "xs:string",
      "status": "needs_input",
      "target": "No direct field in inventorySetQuantities",
      "reason": "An empty element and Not Available are observed; their rules are unknown.",
      "proposed_rule": "Preserve the difference between empty, absent and populated values. Custom display data is a candidate only.",
      "question_ids": [
        "Q01",
        "Q06"
      ],
      "evidence_ids": [
        "source-contract",
        "source-sample",
        "quantity-input",
        "metafields"
      ],
      "decision_basis": "proposal",
      "confirmed_by": null
    },
    {
      "source_field": "AvailableQuantity",
      "source_type": "xs:int",
      "status": "needs_input",
      "target": "inventorySetQuantities.input.quantities[].quantity (candidate)",
      "reason": "The source quantity meaning, authority and location scope have not been established.",
      "proposed_rule": "If confirmed as an authoritative absolute sellable total for a mapped location, propose name=available and use the integer value. Zero remains zero; missing is not zero.",
      "question_ids": [
        "Q01",
        "Q03",
        "Q04"
      ],
      "evidence_ids": [
        "source-contract",
        "source-sample",
        "set-quantities",
        "set-input",
        "quantity-input"
      ],
      "decision_basis": "proposal",
      "confirmed_by": null
    },
    {
      "source_field": "InStock",
      "source_type": "xs:boolean",
      "status": "unmapped",
      "target": "No direct writable field in the selected candidate",
      "reason": "The inventory mutation has no InStock input. Storefront availableForSale is a read result, not a write mapping.",
      "proposed_rule": "Retain for rule analysis; do not map to a read-only availability field or silently discard.",
      "question_ids": [
        "Q01",
        "Q07"
      ],
      "evidence_ids": [
        "source-contract",
        "source-sample",
        "quantity-input",
        "storefront-variant"
      ],
      "decision_basis": "proposal",
      "confirmed_by": null
    },
    {
      "source_field": "SKU",
      "source_type": "xs:string",
      "status": "needs_lookup",
      "target": "inventoryItems(query: sku:...) → inventoryItemId (candidate)",
      "reason": "Requires a confirmed identity rule and a unique match in the actual Shopify store.",
      "proposed_rule": "Keep as text. Resolve the Shopify inventory item ID; reject missing or ambiguous matches. Do not select the first match blindly.",
      "question_ids": [
        "Q05",
        "Q08"
      ],
      "evidence_ids": [
        "source-contract",
        "source-sample",
        "items",
        "quantity-input"
      ],
      "decision_basis": "proposal",
      "confirmed_by": null
    },
    {
      "source_field": "SKUType",
      "source_type": "xs:string",
      "status": "needs_input",
      "target": "Undecided",
      "reason": "Only N appears in this sample; its meaning and other values are unknown.",
      "proposed_rule": "No product-type translation, filter or exclusion until the code list and rules are confirmed.",
      "question_ids": [
        "Q08"
      ],
      "evidence_ids": [
        "source-contract",
        "source-sample",
        "quantity-input"
      ],
      "decision_basis": "proposal",
      "confirmed_by": null
    },
    {
      "source_field": "WebProductId",
      "source_type": "xs:string",
      "status": "needs_input",
      "target": "Identity cross-reference or custom field (candidate)",
      "reason": "It equals SKU in this sample; that does not establish a general identity rule.",
      "proposed_rule": "Keep as text. Do not substitute this value for a Shopify product, variant or inventory ID.",
      "question_ids": [
        "Q05"
      ],
      "evidence_ids": [
        "source-contract",
        "source-sample",
        "items",
        "metafields"
      ],
      "decision_basis": "proposal",
      "confirmed_by": null
    }
  ],
  "questions": [
    {
      "id": "Q01",
      "group": "Start here",
      "question": "What should Shopify do with this feed?",
      "hint": "Update sellable stock, display delivery/availability information, or both?",
      "why": "Determines whether an inventory write is the right target.",
      "affected_fields": [
        "AvailableQuantity",
        "InStock",
        "AvailableDate",
        "AvailableDateRange"
      ]
    },
    {
      "id": "Q02",
      "group": "Source",
      "question": "Where is this XML produced?",
      "hint": "ERP, middleware, Sitecore, or an export? Please also provide a complete response if available.",
      "why": "The sample wrapper differs from the WSDL and is missing two closing tags.",
      "affected_fields": [
        "*"
      ]
    },
    {
      "id": "Q03",
      "group": "Start here",
      "question": "What does AvailableQuantity represent?",
      "hint": "Is this an absolute total or a change? Sellable stock or physical stock? Which system owns it?",
      "why": "An absolute inventory set is suitable only if the source owns the inventory total.",
      "affected_fields": [
        "AvailableQuantity"
      ]
    },
    {
      "id": "Q04",
      "group": "Start here",
      "question": "Which location does the quantity belong to?",
      "hint": "One warehouse/location, a combined total, or separate values elsewhere?",
      "why": "Shopify inventory writes need a location ID; none is supplied.",
      "affected_fields": [
        "AvailableQuantity"
      ]
    },
    {
      "id": "Q05",
      "group": "Identity",
      "question": "How do these identifiers match Shopify?",
      "hint": "Does SKU match the Shopify SKU? Can duplicates exist? What does WebProductId identify?",
      "why": "Resolve actual inventory IDs; do not turn an ERP identifier into a Shopify ID.",
      "affected_fields": [
        "SKU",
        "WebProductId"
      ]
    },
    {
      "id": "Q06",
      "group": "Dates",
      "question": "What do the availability dates mean?",
      "hint": "Meaning of 2049-12-31, timezone, empty date range, and whether customers should see these values.",
      "why": "A possible sentinel date must not become a real delivery promise.",
      "affected_fields": [
        "AvailableDate",
        "AvailableDateRange"
      ]
    },
    {
      "id": "Q07",
      "group": "Availability",
      "question": "What controls InStock?",
      "hint": "Is it derived from quantity, or does it include backorders, fulfilment or other rules?",